title,conversationSchadensursache,"['Hallo,', '', 'ich habe bei zwei gleich aufgebauten Strings auf einem Dach einen Spannungsunterschied über den gesamten Tagesverlauf erkannt. Der Unterschied betrifft eine Modulspannung.', 'Bei einer Sichtprüfung am Dach ist mir dann ein Modul aufgefallen, siehe Bild.', 'Was könnte die Schadensursache sein?', '', '', 'Viele Grüße', 'user4711', '', '', '', 'So locker vom Hocker schwer zu sagen. Hagel, Steine, Ziegel, Vandalismus, Hotspots...\nSieht zwar nur wie Vogelscheisse aus. Ist das Modul gesplittert, oder hat gar Löcher?', 'einstein0', 'Hallo,', '', 'nach Augenschein ist mit kein Glasbruch oder Löcher aufgefallen.', '', 'Ich kann auch nicht mit Sicherheit sagen, dass das Module die Ursache für die verminderte String-Spannung ist. Es könnte auch eines der anderen 11 im String sein. Eines der 12 ist aber auffällig, wie das Bild zeigt', '', 'Hab das der Versicherung gemeldet, die wollen eine Beurteilung von einer Fachfirma haben. Aber in der aktuellen Lage ist es schwer jemanden für einen solchen ""Großauftrag"" zu finden, der ursprüngliche Installateur hat das Geschäft aufgegeben. Ein bereits vereinbarter Termin mit einer anderen Firma wurde nicht wahrgenommen, weiterer Termin zur Klärung immer wieder am Telefon verschoben, wegen krankheitsbedingtem Ausfall eines Mitarbeiters. Ob es stimmt?', '', 'Das mit den Hotspot als Ursache, ist mir nicht unklar. Es gibt keinen Schattenwurf.', 'Werden Hotspots weiß, ohne Erfahrung hätte ich eine Verdunklung der betroffenen Fläche erwartet. - Heiß werden, verbrennen, schwärzen wären da meine Vorstellungen.', '', 'Weitere Hinweise zur möglichen Fehlerursache', 'Ratschläge zum weiteren Vorgehen bzgl. Versicherung aber auch Reparatur?', 'Ein SUNTECH 210 Modul ist derzeit nicht zu haben, wurde mit schlappen 500 Euro gehandelt, dann ist man nicht sicher was man bekommt, ggf. hab ich dann einen vollen String, aber mir fehlt weiterhin die Leistung von einem Modul oder mehr.', 'Welche Lösungsansätze gäbe es mit neuen Modulen?', '* Mir fällt hier nur ein, dass es früher Tigo Duo-Optimizer gab, die es erlauben unterschiedliche Module in einem String aufzunehmen.', '', 'Viele Grüße', 'user4711', 'Kommst du an die Modulkabel dran?', '', 'Wenn ja... dann einfach das betroffene Modul testweise aus dem String nehmen (einfach das ankommende mit dem abgehenden Kabel zusammenstecken) und schauen, was der String dann macht. Ändert sich nichts, dann war es das Modul, sinkt die Spannung um noch eine Modulspannung, dann war es ein anderes.', '', 'Achtung... auf den Strings ist eine hohe Gleichspannung. Wenn du dir nicht 100% sicher bist, was du tun darfst und was nicht, dann mach das lieber nachts (WR vom Strom trennen).', '', 'Welche Lösungsansätze gäbe es mit neuen Modulen?', 'Du kannst auch ein ""stärkeres"" Modul einbauen. Solange es einen höheren Nennstrom hat als die bestehenden, wird es den String nicht ausbremsen. Es wird aber auch nicht mehr Strom liefern können als die vorhandenen, also nicht auf seine volle Leistung kommen. Dürfte aber trotzdem günstiger sein als die Beschaffung eines identischen Moduls.', 'Ok, Vielen Dank für die Tipps, damit ist das Vorgehen für eine Reperatur klar und gleich zwei Herausforderungen gelöst.', 'Anmerkung: Wenn ich die Ziegel hochschiebe komme ich an die Module von unten ran und kann dann verifizieren ob das Module wirklich die Ursache ist, das kann ich auch selbst erledigen.', '', 'Gibt es noch Tipps wie ich das mit der Versicherung regeln kann, wenn ich keinen Installateur finde, der sich meinem Problem anmimmt?', '', 'Viele Grüße', 'user4711', 'Gibt es noch Tipps wie ich das mit der Versicherung regeln kann, wenn ich keinen Installateur finde, der sich meinem Problem anmimmt?', 'Ich würde die Versicherung anrufen und einfach fragen, wie das bei Eigenleistung aussieht. Eigentlich sollten die darüber froh sein, denn das kostet sie am Ende ja viel weniger Geld, als wenn da eine Firma kommt.', '', 'Bei einem Sturmschaden an einem Terrassendach haben wir das so gemacht - da war die Versicherung sehr kooperativ und hat nicht nur das Material bezahlt, sondern auch eine Stundenpauschale für die Eigenleistung. Als Schadensanalyse haben Fotos gereicht.', '', 'Du könntest ja - wenn du das Modul elektrisch vom Rest getrennt hast! - an den Anschlüssen des Moduls messen, was da kommt. Das wäre dann ja auch sehr eindeutig.', '', 'Aber: Nur machen, wenn du dir ganz sicher bist, was du machst. Wenn da noch Stringspannung drauf ist, ist das lebensgefährlich. Ein einzelnes, vom Rest wirklich getrenntes Modul hingegen ist harmlos von der Spannung her.', 'Ja, danke für das Feedback, es bleibt mir vermutlich nichts anderes übrig als diesen Weg zu gehen.', 'Der große Nachteil dabei ist, man muss es halt selbst tun. Kostet Lebenszeit', '', 'Wenn ich das defektverdächtige Module heraus genommen habe und die Spannung bleibt unverändert, ist das auch ein Beweis, wenn auch indirekt, dass das Modul defekt ist.', '', 'Vielen Dank für deine Unterstützung', 'user4711']"
Versicherung bei Mietobjekt,"['Hallo, ich benötige mal das Schwarmwissen.', '', 'Unsere PV ist seit ein paar Tagen in Betrieb. Eine Betreiberhaftpflicht habe ich bereits abgeschlossen . Nun möchte ich natürlich noch eine Versicherung die eventuelle Sturmschäden etc. abdeckt.', '', 'Wir wohnen in einem Haus meiner Schwiegermutter und haben einen ganz normalen Mietvertrag. Betreiber der Anlage bin ich (Schwiegersohn).', 'Mein Versicherungsmakler meint dass es richtig wäre die PV in die Wohngebäudeversicherung aufzunehmen.', 'Ich bin mir nicht sicher ob es wegen der Besitzverhältnisse im Schadensfall nicht zu Streitigkeiten kommen könnte.', 'Wie würdet ihr das lösen?', '', 'Ich hoffe der ein oder andere User hat ein paar nützliche Infos für mich.', 'Hallo, ich benötige mal das Schwarmwissen.', '', 'Wir wohnen in einem Haus meiner Schwiegermutter und haben einen ganz normalen Mietvertrag. Betreiber der Anlage bin ich (Schwiegersohn).', 'Mein Versicherungsmakler meint dass es richtig wäre die PV in die Wohngebäudeversicherung aufzunehmen.', 'Ich bin mir nicht sicher ob es wegen der Besitzverhältnisse im Schadensfall nicht zu Streitigkeiten kommen könnte.', 'Wie würdet ihr das lösen?', 'Hallo SAN84,', '', 'da das Gebäude deiner Schwiegermutter gehört und auch die Versicherung über sie läuft, solltest Du dein Eigentum (PV-Anlage) über eine eigenständige z. B. Photovoltaikversicherung (auf deinen Namen) versichern.', '', 'Gruß', 'rosa']"
Erfahrung mit VHV Versicherung TOP,"['Hallo,', 'Ich wollte hier einfach mal schreiben wie überaus positiv meine Erfahrungen mit meiner VHV Photovoltaik- Vesicherung ist.', 'Am 27.07.2019 wurden nach einem Blitzschlag in die oberirdische Telefonleitung die Fritzbox , der Solarlog , die Wechselrichter samt Schnittstelle ausgetauscht . Ebenso hatte ich aufgrund langer Wartezeit auf die neuen SMA-Wechselrichter Ausfallzeiten.', 'Gesamtschaden über 10.000 Euro.', 'Der Schaden wurde schnell und unbürokratisch von VHV beglichen.', 'Ich bin ansonsten kein Fan von Versicherungen weil die immer versuchen sich aus der Verantwortung zu ziehen, aber hier ist eine Versicherung die wirklich da ist wenn sie gebraucht wird.', '', 'Grüße an alle Sonnenfans...', 'Hallo', '', 'meine Erfahrung mit der VHV ist nicht so toll.', 'Nachdem ein Unwetter vorbeigezogen war, hatte der Wechselrichter wegen Überspannung aufgegeben.', '', 'Der Fall wurde gemeldet, der Wechselrichter musste eingeschickt werden zur Überprüfung bei eine Gutachter.', 'Festgestellt wurde dein elektronischer Schaden der Verschleißteile! Reparatur wäre nicht möglich.', 'Das Gerät wurde zurückgeschickt , Schadenbegleichung abgelehnt.', '', 'Fazit für mich: Versicherung wurde gekündigt, ein Schaden direkt nach einen Gewitter, ein Zweit-Gutachten o. klage lhnt nicht eine Versicherung aber auch nicht.', '', 'Die Gebäudeversicherung reicht hier aus , für evt Ertragsausfälle o. Elektronikschäden loht die VHV nicht.', '', 'Gruß Gimpel', 'Hallo Zusammen!', '', 'Als Versicherungsmakler bieten wir die VHV Photovoltaikversicherung im Rahmen eines Sonderkonzeptes an und können die positiven Erfahrung von maria-zen nur teilen. Die VHV ist im Rahmen von Schadenbearbeitungen sehr schnell und korrekt.', '', 'gimpel', 'Der Versicherer hat Zugriff auf eine Blitzdatenbank. In dieser ist ersichtlich, wann und wo ein Blitz eingeschlagen ist. Darauf basierend kann auch recht genau eine Schadenwahrscheinlichkeit in der Umgebung bestimmt werden. Ist der Versicherer der der Auffassung, dass der Schaden nicht durch das Gewitter (Blitzeinschlag in der weiteren Umgebung) zustandegekommen sein kann, beauftragt er einen Sachverständigen. Somit wird bei kundenorientierten Versicherungsunternehmen sichergestellt, dass der Kunde nicht benachteiligt wird. Diese Vorgehensweise kostet den Versicherer zwar Geld, stellt aber sicher, dass der Schadensfall gem. der Versicherungsbedingungen behandelt wird.', '', 'Gruß', 'rosa', 'Hallo,', '', 'wenn dieses Verfahren angewendet werden würde, hätte ja gar kein Gutachter eingeschaltet werden müssen, denn der Blitzeinschlag wurde ja dokumentiert.', 'siehe https://www.blitzortung.org/', '', 'Die Versicherung hatte ich übrigens über Sie abgeschlossen, das Sie die VHV positiv sehen ist sicher für jedermann nachvollziehbar.', '', 'Schöne Grüße', 'Gimpel', 'Über wen die Versicherung abgeschlossen wurde war mir nicht bekannt und ist auch nicht relevant.', 'Der Versicherer hat letztendlich ein Gutachten beauftragt, was nicht zu Ihren Erwartungen führte. Ihre Enttäuschung kann ich nachvollziehen, aber in der Sache ist jedoch alles korrekt gelaufen.', '', 'VG', 'rosa']"
Vorgehensweise und Erfahrung mit Willis bei evtl. Dachschaden?,"['Wir haben über eine Winaico Rahmenvereinbarung 2017 eine Willis ALL inklusive Versicherung abgeschlossen auf 10 Jahre.', '', 'Nun tritt vermutlich der Fall der Fälle ein.', '', 'Nach einem Sturm mit Hagel und sehr sehr starkem Regen, tropfte es bei uns aus der Decke.', 'Nun geh ich davon aus, dass durch die vielen Stürme in letzter Zeit ein Dachziegel undicht wurde bzw. gebrochen ist.', 'Leider damals wie noch üblich mit eingeflexten Dachziegeln, statt Aluziegeln mit Haken.', '', 'Und dann läuft das Wasser die Aufdachdämmung runter - in die ""Holzständerwand"" und kommt dann auf unserer Massivholzdecke durch im EG...', '', 'Ich lese die Versicherungsbedingungen so, dass Schäden an Gebäudeteilen (Dach, Dacheindeckung) im Bereich der PV enthalten ist.', '', 'Leider lese ich in den Bedingungen nirgends so recht, wie ich nun vorzugehen habe?', 'Meldung an Versicherer?', 'Dachdecker kommen lassen, der mir Fotos macht und das an den Versicherer weiterreichen?', 'Wahrscheinlich muss man dazu ein, zwei, drei Module abmontieren, damit man die richtigen Stellen sieht.?', '', 'Wie würdet Ihr da Vorgehen?', 'Hat keiner so etwas ähnliches schon mal durchgemacht und Erfahrungstipps?', 'Ruf doch mal bei der Versicherung an.', '', 'Nur die können Dir sagen, wie sie es wollen.', '', 'Das macht ggfs. jeder anders.', '', 'Anrufen, dann hast Du die Info in 5 Minuten.', '', '[Edit:]', '', 'nach 5 Minuten googlen gefunden, ohne Vertragsunterlagen:', '', '', 'Link zum pdf: KLICK', 'Ruf doch mal bei der Versicherung an.', '', 'Nur die können Dir sagen, wie sie es wollen.', '', 'Das macht ggfs. jeder anders.', '', 'Anrufen, dann hast Du die Info in 5 Minuten.', '', '[Edit:]', '', 'nach 5 Minuten googlen gefunden, ohne Vertragsunterlagen:', '', '', 'Link zum pdf: KLICK', '', 'Top. Vielen Dank...', '', 'da wäre ich nicht drauf gekommen per Google nach dem Ablauf zu suchen, der in den Versicherungsbedingungen und dem ganzen Papier kram nirgends aufgeführt ist, den ich damals erhalten habe...', 'Telefon - erreichbar... Naja - niemand.', '', 'Reaktion auf meine Mail, mit Fragebogen, oder Ticket Nummer wie heute durchaus üblich, oder ein anruf.... Leider auch nicht .', '', 'Jackpot. Läuft.....', 'Liest sich (leider) wie eine Versicherung der Gebrauchtwagenhändler', '', 'Vermutlich das Papier nicht wert, auf dem es geschrieben steht... Schade...', 'Liest sich (leider) wie eine Versicherung der Gebrauchtwagenhändler', '', 'Vermutlich das Papier nicht wert, auf dem es geschrieben steht... Schade...', 'Fürs erste kann ich Entwarnung geben...', '', 'Inzwischen nachdem ich nochmals nachgefragt habe, kam tatsächlich eine Reaktion.', 'Das übliche (Fragen über Fragen) - aber schon mal ne Vorgangsnummer', '', 'Aktuell bin ich schon dran überhaupt einen Solateur oder Dachdecker zu finden der das betroffene Dach anschaut.', '', 'Evtl. ist das sogar ein Thema der ""normalen"" Gebäudeversicherung hat der PV Versicherer indirekt angedeutet.', 'Bin gespannt wer sich da zuständig für hält....', '', 'Wenn ich es recht ""durch die Blume verstehe"". Dann fühlt sich die PV Versicherung zuständig, wenn das Wasser über den Ziegel mit dem PV Haken reinkommt. Wenn dagegen ein ""freier"" Ziegel neben dem PV Haken gebrochen ist, dann wäre das ein Sturmschaden = Gebäudeversicherung...', 'Ok, aber das ist ja verständlich.', 'Die „normalen“ Ziegel wurden ja theoretisch nicht angefasst.', '', 'Aber schön, dass Bewegung in die Sache kommt.']"
Versicherung für Balkonkraftwerke,"['Hallo,', '', 'gibt es eine Versicherung extra für Balkonkraftwerke?', 'Und oder sind die in einer Hausratversicherung oder Gebäudeversicherung meistens inklusive?', 'Meine Haushaltversicherung/Gebäudeversicherung hat es problemlos angenommen, ohne Mehrkosten (HDI in Österreich)', 'Einfach mal bei deiner Versicherung nachfragen und dann bei Inbetriebnahme informieren.']"
HUK24 erhöht Beitrag ohne Zustimmung,"['Hallo, ich habe eine Frage bezüglich der Versicherung.', '', 'Gemäß hiesiger Empfehlung habe ich meiner Wohngebäude-Versicherung (HUK24) mitgeteilt, dass ich eine PV-Anlage habe. Ich habe um ein Angebot bezüglich evtl. steigender Kosten gebeten aber gleichzeitig mitgeteilt, dass ich als Alternative eine spezielle PV-Versicherung prüfe. Die HUK schickt mir als Antwort eine Bestätigung, dass die PV-Anlage in der Wohngebäudeversicherung jetzt eingeschlossen ist und dass der Beitrag um etwa 60€ steigt.', '', 'Dem habe ich widersprochen. Ich hätte noch keinen Auftrag erteilt und prüfe noch die Spezialversicherung. Antwort der HUK:', '', '""Der Grundschutz (Feuer und Sturm) für die Photovoltaikanlage ist im Vertrag mitzuversichern. Durch die Photovoltaikanlage steigt das Brandrisiko.', 'Die Allgefahrendeckung können Sie anderweitig versichern.', 'Ihre Anlage kann bei uns nicht aus dem Versicherungsschutz entnommen werden.""', '', 'Ist das so in Ordnung? Ich dachte bei einer speziellen PV-Versicherung ist das (Grundschutz, Feuer, Sturm) ebenfalls beinhaltet?', '', 'Danke für Eure Antwort.', 'Du must die Vertragsbedingungen Deiner Wohngebäudeversicherung lesen. Man kann Verträge ja frei gestalten. Die PV-Anlage ist fest mit dem Gebäude verbunden und erhöht das Risiko auch für das Gebäude selbst. Die Sichtweise der HUK ist zumindest nachvollziehbar. Trotzdem können andere Gebäuderversicherungen das ggf. anders machen und den Beitrag für das Gebäude nicht erhöhen. Du zitierst ja: ""Ihre Anlage kann BEI UNS ....""', 'Das ist so leider richtig. Wir mussten die HUK24 damals informieren wegen des erhöhten Risikos (s. Versicherungsbedienungen). Glücklicherweise wurde bei uns nicht der Beitrag erhöht.', 'Die gängigen PV-Versicherungen sind sogenannte Elektronik- oder Technikversicherungen. Es ist also wichtig den Gebäudeversicherer, der weiterhin für Feuerschäden am Gebäude verantwortlich ist zu informieren.', '', 'Wir haben mittlerweile der HUK24 gekündigt und sind bei der GEV. Dort war für uns alles zusammen günstiger und mehr Leistung (elementar inkl.)', 'Ich bin bei der Allianz. Hab das denen dann auch mitgeteilt, da ist es dann kostenlos mitversichert.', 'Habe aber trotzdem noch separat bei INTER Group eine Versicherung, da die Allianz nicht alles abdeckt.', '', 'Ich zahle bei der INTER Group 86 € im Jahr, da ist auch der Speicher mitversichert. Versicherungssumme 16.000 € Netto.', 'Wir haben beispielsweise die R+V.', 'Dort kann man kostenfrei bis zu 10kWp aufnehmen lassen.', 'Nachdem wir jetzt fast 15kWp auf dem Dach haben, wurde der Beitrag angepasst.', 'In Kombination mit aktualisiertem Vertrag würde es bei uns sogar minimal günstiger.', '', 'Ontop bedarf es aber sicherlich einer spezialisierter OV Versicherung.', 'In der Gebäude ist die PV ja nur absolut rudimentär abgesichert.', 'Bei mir hat die HUK-Coburg bei der Wohngebäudeversicherung durch Anmeldung einr PV-Anlage (24.79 KWp) richtig zugeschlagen. 268 € darf ich zusätzlich zum alten Betrag der Wohngebäudeverzicherung berappen. Malzeit!', '', 'Kann man eigentlich bei der EÜR diesen Betrag als Ausgaben mit abrechnen?', 'Würde ich einfach mal ansetzen.\n\nMehr als ihn wieder rausstreichen, macht das FA ja nicht, wenns ihnen nicht passt.', 'Danke für den Zuspruch.', 'Werde ich bei der EÜR versuchen.', 'Bei mir hat die HUK-Coburg bei der Wohngebäudeversicherung durch Anmeldung einr PV-Anlage (24.79 KWp) richtig zugeschlagen. 268 € darf ich zusätzlich zum alten Betrag der Wohngebäudeverzicherung berappen. Malzeit!', 'Das haben wir jetzt schon häufiger mitbekommen. Die HUK nimmt wirklich sehr hohe Beitragszuschläge. Da lohnt es sich unter Umständen nach anderen Versicherern ausschau zu halten und Gebäude- und Photovoltaikversicherung zu trennen.', '', 'Gruß', 'rosa', 'Ganz wichtig ist wohl, die PV Anlage überhaupt dem Gebäudeversicherer zu melden.\n\nDie Huk wertet das wohl als ""Gefahrerhöhung""\n\nGefahrerhöhung muss man sehr ernst nehmen, denn damit ist im Schadensfall der Versicherungsschutz massiv gefährdet.\nDas ist sogar ein Schritt mehr noch, als grobe Fahrlässigkeit.']"
Versicherung,"['Hallo liebe Gemeinde', '', 'Ich bin absoluter Anfänger und muss unsere PV Anlage versichern. Diese wurde diesen Monat aktiviert, hat 18.8 Kwp - bei 25525€ Netto (Regelbesteuerung JA).', 'Weiterhin habe ich 2 Wallboxen im Gesamtwert 3000€ Brutto (inkl. Montage) - (abzgl. 2x900€ Förderung).', '', 'Ich bin hier hin und hergerissen, ob die SunSafeTop Versicherung ausreicht oder die VHV...der Kopf ist irgendwie voll', '', 'Wir haben alle Versicherungen über die HUK Coburg laufen. Bei der Gebäudeversicherung die Anlage reinzunehmen, wäre mit 250€ viel zu teuer...', '', 'Ich wäre da sehr dankbar, ob jemand ""privates"" einen guten Ratschlag geben könnte, bei wem ich gut aufgehoben bin', '', 'Vielen Dank + Gruß', 'joe', 'Moin,', '', 'was sollte denn daran nicht ausreichen?', 'Wofür, wogegen?', 'Hallo liebe Gemeinde', '', 'Ich bin absoluter Anfänger und muss unsere PV Anlage versichern. Diese wurde diesen Monat aktiviert, hat 18.8 Kwp - bei 25525€ Netto (Regelbesteuerung JA).', 'Weiterhin habe ich 2 Wallboxen im Gesamtwert 3000€ Brutto (inkl. Montage) - (abzgl. 2x900€ Förderung).', '', 'Ich bin hier hin und hergerissen, ob die SunSafeTop Versicherung ausreicht oder die VHV...der Kopf ist irgendwie voll', '', 'Wir haben alle Versicherungen über die HUK Coburg laufen. Bei der Gebäudeversicherung die Anlage reinzunehmen, wäre mit 250€ viel zu teuer...', '', 'Ich wäre da sehr dankbar, ob jemand ""privates"" einen guten Ratschlag geben könnte, bei wem ich gut aufgehoben bin', '', 'Vielen Dank + Gruß', 'joe', 'Hi Joe,', '', 'Ich suche auch nach einer Versicherung.', 'Bin in einer ähnlichen Leistungs- und Preisklasse. Wallboxen aber nur für 900€.', 'Hast du schon eine Entscheidung getroffen?', '', 'Die SunSafeTop wird hier im Forum ja oft genannt...', '', 'LG', 'Servus,', 'Ich klinke mich auch mal hier ein.', 'Ich suche zur Zeit auch eine Versicherung.', 'Ich bin auf die sunmaxx gestoßen.', 'Aber ich glaube im Vergleich könnte die Sunsafe Top auch was geeignetes sein.', 'Wie sind den so eure Erfahrungen mit den Versicherungen?Gibt es noch andere Anbieter?', 'LG Matthias', 'Hab Inter über rosa Photovoltaik genommen', 'Bestehende Gebäudeversicherung mit höchster Deckungsstufe ergänzt (Aufpreis ca. 30€ p.a.)', 'Servus,', 'Ich klinke mich auch mal hier ein.', 'Ich suche zur Zeit auch eine Versicherung.', 'Ich bin auf die sunmaxx gestoßen.', 'Aber ich glaube im Vergleich könnte die Sunsafe Top auch was geeignetes sein.', 'Wie sind den so eure Erfahrungen mit den Versicherungen?Gibt es noch andere Anbieter?', 'LG Matthias', 'Die hab ich auch im Visier. Im Prinzip kommt es mir auch nicht auf paar Euro an.', 'Möchte eine Versicherung, die im Falle eines Schadens, alles stressfrei abwickelt.', 'Tatsächlich habe ich noch keine Entscheidung getroffen, da ich gehofft habe, dass ein erfahrenes Mitglied hier einen guten Ratschlag geben kann, welches der Versicherungen am besten wäre bzw. genügend abdeckt....', 'Servus,', 'Ich klinke mich auch mal hier ein.', 'Ich suche zur Zeit auch eine Versicherung.', 'Ich bin auf die sunmaxx gestoßen.', 'Aber ich glaube im Vergleich könnte die Sunsafe Top auch was geeignetes sein.', 'Wie sind den so eure Erfahrungen mit den Versicherungen?Gibt es noch andere Anbieter?', 'LG Matthias', 'Die hab ich auch im Visier. Im Prinzip kommt es mir auch nicht auf paar Euro an.', 'Möchte eine Versicherung, die im Falle eines Schadens, alles stressfrei abwickelt.', 'Sehe ich ähnlich.', 'Ich suche ein komplett Paket. Würde mich ärgern-wenn ich sie mal brauche und es dann nicht klappt.', 'Nutzt ihr alle 3 Versicherungen?', 'Ertragsausfall und Haftpflicht auch?Oder nur die reine PV Versicherung? Die Debeka(meine Hauotversicherung) möchte auch ca. 100 Euro im Jahr bei deutlich schlechteren Leistungen und ohne Haftpflicht...']"
"Versicherung läuft über andere Person, wie regeln","['Moin,', 'Bei mir befindet sich die Solaranlage derzeit im Bau. Mit der WGV sind wir bei HUK, allerdings über meine Frau versichert. Die Solaranlage wird über mich laufen.', 'Ich würde die Kosten/Erhöhung von ca 30 EUR pro Jahr gerne bei der Steuer mit angeben.', 'Ist es ein Problem, dass es über meine Frau läuft? Ansonsten würde ich die kündigen und entsprechend eine neue/andere abschließen.', 'Ich bin kein Versicherungsprofi, aber ich würde erstmal überprüfen, ob die Versicherung deiner Frau, üerhaupt für deine PV Anlage aufkommt im Schadensfall. Da wäre mir das Finanzamt erstmal zweitrangig.']"
