title,conversation
Versicherungen,[]
Zugriff verweigert,[]
Willis Versicherung,"['Hallo @ all,', 'wir haben im Oktober 2018 unsere PV - Anlage, über den Winaico Rahmenvertrag, im Willis Online Portal versichert. Jetzt etwa 1 Jahr später hab ich festgestellt, das mir Unterlagen dazu fehlen bzw. abhanden gekommen sind. In der Regel ist das bei Versicherern mit einer E-Mail erledigt und man hat Post im Briefkasten.', 'Bei Willis scheint es aber eines zu sein.', 'Im Online Portal hatte ich keinen Zugang mehr (Zugangsdaten definitiv richtig eingegeben), keine Reaktion auf E-Mail´s seit 3 Wochen und telefonisch bekommt man auch niemanden.', 'Meine Frage an euch wäre : Hat bisher jemand von euch in irgendeiner Form Kontakt zu WIllis gehabt bzgl. einer Anfrage oder eines Schaden´s?', 'Selbst wenn mit dem Versicherer alles in Ordnung ist/wäre dann möchte ich nach meiner persönlichen Erfahrung jetzt, mit denen keinen Schaden abwickeln wollen.', 'Berichtet bitte mal von euren ""ECHTEN"" Erfahrungen und nicht nur das man komplikationslos euren Beitrag genommen hat', 'Danke euch schon mal im voraus!', 'Hat denn hier niemand eine Versicherung bei Willis für seine PV -Anlage ? Mein Stand der Dinge ist derzeit . das die 4te Woche der versuchten Kontaktaufnahme morgen vorbei ist und ich bisher lediglich eine ""Vermittlung"" erreicht habe. Interessant daran ist, das ich ja ""nur"" fehlende Papiere haben will. Bei einem Schaden sollte man sich wohl sicherheitshalber direkt an einen Anwalt wenden.', 'Hallo, mein Konto war ebenfalls gesperrt. Nach einem Passwort Reset über die Website kann ich wieder zugreifen. Ich habe keine Erfahrungen mit Kontaktaufnahme, eine kurze Googlesuche hat zumindest keine Anzeichen für eine Insolvenz aufgezeigt.', 'Einen guten Eindruck macht das aber nicht ...', 'Hallo Zusammen,', '', 'der Risikoträger zu Eurer Photovoltaikversicherung scheint die ERGO Versicherung zu sein. Versucht doch darüber etwas zu erreichen.', '', 'Gruß', 'rosa', 'rosa', 'Danke für die Info.', 'Aber es wird wohl darauf hinaus laufen , das wir beim ersten Schaden an der Anlage, direkt den Anwalt einschalten werden. Jetzt brauche ich nur Papiere aber wenn es mal einen Schaden gibt, habe ich für so einen Mist keine Zeit. Von meiner Seite kann ich nur sagen: Finger weg von WIllis!', 'Hallo zusammen,', '', 'ich versuche aktuell ebenfalls einen Schaden bei Willis zu melden. Ich habe bei der Zentrale in Frankfurt angerufen, aber scheinbar ist da seit 2 Tagen niemand erreichbar, an den mich die Zentrale verbinden könnte. An wen habt ihr euch denn gewendet? Ich überlege auch schon das meinem Anwalt zu übergeben, weil ich mir ziemlich ver..scht vorkomme.', 'Hi mhosun,', 'im Prinzip genau meine Erfahrungen mit Willis, nur halt ohne Schaden an der PV Anlage. Ich hoffe mal das es so bleibt. Vielleicht setzt du denen nochmal schriftlich eine Frist und dann ab zu Anwalt...', 'Ich habe nochmal in meinen Unterlagen geschaut. Ich habe die Versicherung über einen Rahmenvertrag von meinem PV-Anbieter abgeschlossen. Ich bin also ""nur"" mit-versichert. Der Anbieter ist mittlerweile pleite gegangen bzw. gibt es nicht mehr. Von daher gehe ich davon aus, dass mein Versicherungsschutz ebenfalls hopps gegangen ist, weil es den Vertrag mit dem Anbieter nicht mehr geben wird. Kennt sich da jemand aus, bzw. habe ich dann weiter anspruch auf die Versicherung bevor ich da jetzt ein Fass mit Anwalt und Co. aufmache.', '', 'Danke u Gruß', 'Das hört sich alles nicht nach dem an, was man in einer Versicherung sucht - nämlich Sicherheit', '', 'Ich stehe auch kurz vor der Entscheidung, da für 10J im Vorraus zu bezahlen.', '', 'Ich habe den in der Police angegebenen Makler angeschrieben: Reply: nicht verfügbar auf unbestimmte Zeit. Ich habe nun einen weiteren Kontakt bei Willis, den ich hier im Forum gefunden habe, angeschrieben - mal sehen.', '', 'Ich habe aber zurzeit auch kein gutes Gefühl.', '', 'Ich finde auch in dem Policen-Dokument keine Angabe, wie die Regulierung wirklich abläuft: Kontakt, Zeiten etc. Habt ihr dazu Erfahrung?', 'Ok, gerade eine Nachricht vom Mailsystem von Willis bekommen. Person scheint dort nicht mehr zu arbeiten.']"
Welche PV Versicherung,"['Hallo zusammen,', '', 'ich betreibe eine PV Anlage mit 47 kW/p. Selbstverständlich habe ich eine Komplettversicherung inkl. Ertragsausfall abgeschlossen. Letztes Jahr ging mein Wechselrichter kaputt und ich musste viele Wochen auf einen neuen warten. Die Versicherung teilte mir mit, dass ich den Ertragsausfall nicht geltend machen könne, weil es sich bei dem Schaden um einen Gewährleistungsfall innerhalb der 10 Jahres Garantie handle.', '', 'Jetzt zu meiner Frage:', '', 'Welche PV Versicherung deckt so einen Schaden ab und in welcher Höhe. Hat jemand auch gute oder schlechte Erfahrungen mit Versicherungen gemacht.', '', ""Ich freue mich auf gute Info's."", '', 'Grüße.\nMichi.', 'Moin Michi,', '', 'willkommen im PV-Forum .', '', 'Das ist natürlich schlecht. Sicherlich handelte es sich um einen ABB WR.', '', 'Bzgl. Schadenabwicklung kann ich Dir aus eigener Erfahrung die Condor via ROSA Versicherungen empfehlen.\nGibt aber noch andere sehr gute Versicherungen wie z.B. KRIST etc.', '', 'Gruß\nMBiker_Surfer', 'Hallo Michi,', '', 'die Begründung Gewährleistungsfall ist meiner Meinung nach nicht ganz richtig. Hier wird es eher daran gelegen haben, dass kein versicherter Sachschaden vorlag. Der WR ist doch einfach nur so ausgefallen oder? Oder gab es ein Ereignis ( Blitzüberspannung, Bedienungsfehler oder ähnliches) voher? Sollte der WR durch einen technischen Defekt ausgefallen sein, hätte hier meines Wissens nach auch kein anderer Versicherer den Ertragsausfall geleistet.', '', 'Gruß\nLemke', 'Sollte der WR durch einen technischen Defekt ausgefallen sein, hätte hier meines Wissens nach auch kein anderer Versicherer den Ertragsausfall geleistet.\nGruß\nLemke', '', 'Und genau hier irrst Du Dich eben gewaltig', '', 'Gruß\nMBiker_Surfer', 'Genau um das geht es mir. Es gab keinen Blitzschlag, Überspannung etc, aber trotzdem fiel der WR aus. Es war nur ein Relais, aber der ""Service"" von ABB wechselte gleich den ganzen WR aus, was sich über viele Wochen hinzog. Letztendlich hat ABB dann aus ""Kulanz"" doch einen kleinen Betrag überwiesen, aber auch erst, als ich mich mit der Zentrale in der Schweiz kurzgeschlossen hatte. Meine Versicherung zahlte ebenfalls aus ""Kulanz"" einen gar noch kleineren Betrag. Deswegen suche ich eine neue Versicherung, die eben genau solche Schäden abdeckt, gepaart mit einem Dienstleister (rosa, Krist etc.), der auch im Schadenfall hinter mir steht.', '', 'Grüße.\nMichi.', 'Hallo Einstein,', '', 'entweder habe ich das bei der Condor überlesen oder es ist auch dort nicht versichert. Wo steht das denn in den aktuellen Bedingungen der Condor', 'Hallo Einstein,', '', 'entweder habe ich das bei der Condor überlesen oder es ist auch dort nicht versichert. Wo steht das denn in den aktuellen Bedingungen der Condor', '', 'Vllt. meinst Du mich\nDaher schreibe ich ja, ROSA, Krist etc. - die haben bessere Bedingungen als CONDOR Standard!', '', 'Gruß\nMBiker_Surfer', 'Ja Logo meinte ich dich,', '', 'sorry war wohl irritiert bezgl. Forumseinstein und habe das verwechselt.', '', 'Habe mir die besonderen Bedingungen bei Roso gezogen und ich finde da nichts!!!!', '', 'Vielleicht kannst du mir ja die Stelle nenne wo das steht.', 'Vielleicht kannst du mir ja die Stelle nenne wo das steht.', '', 'Stichwort ist da: Innere Betriebsschäden und Unterbrechung. TCR 1143 und TCR 4203 (aus meiner Police entnommen)', '', 'Gruß\nMBiker_Surfer', 'Hallo MBIKER_SURFER,', '', 'du hast Recht!! bis 1.500 € wäre es tatsächlich versichert. Hatte die TCR 4203 erst anders interpretiert. Habe dann mal unseren Spezialisten bei der Inter (auch bei ROSA) angerufen. Der Spezi dort hat mir die Deckung bestätigt. Bei der Inter Premiumdeckung ( habe ich ) wäre es auch versichert. Allerdings nur bis 500 €.', '', 'Gruß Lemke']"
Nochmalige Garantieverlängerung für 10 Jahre altem SMA Wechselrichter?,"['Meine Anlage besteht am 10. Oktober für 10 Jahre. Teil der Anlage ist ein SMA Tripower 10000TL-10. Dieser hat schon vor 5 Jahren eine Garantieverlängerung bekommen. Seither lief der WR ohne Probleme. Er hatte aber auch schon den grünen „Quality ok“-Aufkleber.', '', 'Da ich nichts gefunden habe zuerst folgende Frage:', 'Gerade wenn ich mir so die Verfügbarkeit in diversen Shops anschaue, dann scheint es so zu sein, dass größere WRs nicht oder nur mit einem halben Jahr Verzögerung lieferbar sind.', '', '(Vor gleicher Fragestellung stehe ich mit einem SMA Tripower 8000TL-20 dann nochmal im Januar.', '', 'Wäre für Tipps und Meinungen dankbar.', 'Da es hier im Forum scheinbar niemand wusste und mein Solarteur sich nicht gemeldet hat, habe ich gestern SMA selber angeschrieben.', '', 'Zuerst: Hammer-Reaktionszeit von SMA. Gestern (Sonntag) eine Mail hingeschrieben, heute um 9:30h eine Rückantwort gehabt. Sehr geniale Reaktionszeit.', '', 'Hier die Antwort:', '1.) Für die TL-10-Serie wird ""aufgrund von Entwicklungen in der LIeferkette"" keine Verlängerungsoption der Garantie mehr angeboten. Reparatur oder AT-Geräte werden weiterhin angeboten.', '2.) Für meinen 8.000 TL-20 ist eine Verlängerung um weitere 5 oder 10 Jahre aber möglich.', '', 'Bin gerade am Überlegen ob ich direkt 10 Jahre mache.', 'Was kostet die Verlängerung? Was kostet aktuell ein neuer WR?', 'Ich stand auch vor der Entscheidung. Bei mir hat es sich nicht rentiert.', 'Was kostet die Verlängerung? Was kostet aktuell ein neuer WR?', 'Für den STP-8000 sind es 330 Euro Netto für 5 Jahre Verlängerung bzw. 660 Euro für 10 Jahre. Vor 5 Jahren waren es IMO noch unter 300 Euro.', 'Verkauft wird er gerade für 2.000 bis 2.500 Euro.', 'Geliefert wird er allerdings erst in 24 bis 30 Wochen, bei so ziemlich jedem Internet-Shop.', 'Ich stand auch vor der Entscheidung. Bei mir hat es sich nicht rentiert.', 'Ob es sich rentiert, weiss ich ehrlich gesagt auch nicht. Im Endeffekt hast Du über die komplette Garantiezeit von 20 Jahren den halben Neu-Preis ausgegeben und dann ggf. ein 20 Jahre altes Gerät.', 'Aber meine Gedankengänge sind:', '1.) Zurzeit gibt es scheinbar keine SMA-WRs schnell verfügbar. SMA will zwar bi 2024 von 20 auf 40GW Output allein in Kassel hoch, aber das hilft mir a.) jetzt nichts und b.) ist es nicht unwahrscheinlich, dass die gesamten 40 GW 2024 vom Markt absorbiert werden werden.', '2.) Frage ich mich ob es nicht besser ist jetzt nochmal 660 Euro zu investieren und dann wirklich 20 Jahre lang save zu sein oder mit Pech im 15. Jahr nochmal 2.000 Euro für 5 Jahre EEG-Restlaufzeit zu investieren.', '', 'Das sind so meine Gedankengänge.', 'Mal ein ganz anderer Gesichtspunkt. Wenn nächstes Jahr eh die steuerliche Neuregelung kommt, wäre es unter Umständen sinnvoll, dieses Jahr nochmals die Ausgaben zu erhöhen, um einen steuerlichen Verlust zu haben. Die MwSt bekommt man ja auch erst nächstes Jahr ersetzt. Damit könnten sich solche Garantieverlängerungen richtig lohnen …', 'Ich habe mich jetzt mit der Themaik echt noch nicht beschäftigt, aber trifft das nicht nur Neuanlagen ab 2023? Ich bin eigentlich davon ausgegangen, dass ich als Altanlagenbetreiber immer noch unter die alte Gesetzgebung fallen.', '', 'Ganz davon abgesehen: Ich habe jetzt für den WR, wo die Verlängerung noch möglich war auf die kompletten 20 Jahre verlängert. Der Code ist schon eingegeben. Ich warte jetzt allerdings schon zwei werktage darauf, dass der Garantiezeitraum ""binnen 24 Stunden"" aktualisiert wird.', '', 'Ansonsten ist aber bisher alles gut von Seiten SMA gelaufen, was die Reaktionszeiten angeht.', 'Habt Ihr mal auf der SMA Seite unter Produktregistrierung geschaut? Bei meinem Okt-2021 gekauften WR (STP10.0) war ein Garantieverlängerungskärtchen dabei. Das ging online und 5 (?) Jahre gab es zusätzlich on top, jetzt bis Okt-2031... war evtl nur eine kurze Aktion von SMA?', '', 'Habt Ihr mal auf der SMA Seite unter Produktregistrierung geschaut? Bei meinem Okt-2021 gekauften WR (STP10.0) war ein Garantieverlängerungskärtchen dabei. Das ging online und 5 (?) Jahre gab es zusätzlich on top, jetzt bis Okt-2031... war evtl nur eine kurze Aktion von SMA?', 'Das scheint es immer noch zu geben. Damit passt SMA quasi die Garantielänge der der Konkurrenz an.', 'Geht halt nur bei neuen WRs.', 'Ganz davon abgesehen: Ich habe jetzt für den WR, wo die Verlängerung noch möglich war auf die kompletten 20 Jahre verlängert. Der Code ist schon eingegeben. Ich warte jetzt allerdings schon zwei werktage darauf, dass der Garantiezeitraum ""binnen 24 Stunden"" aktualisiert wird.', 'Kurzer Nachtrag: Statt 24 Stunden wurden es jetzt 4 Tage bzw. 2 Werktage aber der WR ist jetzt bis 2033 in der Garantieverlängerung.']"
Welche Versicherungen für grundlos gekündigte Anlage aus 2009 auf landwirtschaftlichem Betrieb ?,"['Hallo,', 'der Versicherer, Name beginnt mit W, möchte jetzt nach 13 Jahren ab Anfang Dezember kündigen, sowohl die Betreiberhaftpflicht auf gepachtetem Dach als als auch die Anlagenversicherung. Aus unserer Sicht grundlos, denn wir haben bisher in fast 13 Jahren nie einen Schaden gemeldet, immer schön die Beiträge überwiesen. Meine Anfrage für einen Neuabschluss bei dem hier gut bekannten Makler Rosanovski ergab dass die maximal PV-Anlagen bis zu einem Alter von 8 Jahren versichern wollen. Ganz Toll ! Und was sollen jetzt die Leute mit älteren PV-Anlagen machen die einfach eine Kündigung erhalten ?', 'Ich bin dankbar für brauchbare Empfehlungen von geneigten Versicherern hier. Die Anlage hat 32 kWp.', '', 'Viele Grüße:', '', 'bm3']"
Versicherung (Haftpflicht und Wohngebäude) bei Eigenbau,"['Hallo DIY/PV-Betreiber in Eigenbau,', '', 'wer kann mir Versicherungen nennen (Wohngebäude und private Haftplicht) die den Versicherungsumfang bei Eigenbau der PV Anlage explizit mit anbieten?', '(nicht abfragen genügt mir nicht)', 'Es gibt ""PV Versicherungen"" wo man das Häkchen ""Eigenbau"" setzen kann, mir geht es aber um die Wohngebäude- und private Haftpflicht.', '', 'Welche Versicherung bietet diese Option an? (EFH, 9,75kWp)', 'Danke!', 'update:', 'Ein Punkt ist schon einmal gelöst:', '', '""...', 'vielen Dank für Ihre Nachricht.', '', 'Wir haben vermerkt, dass Sie die Photovoltaikanlage auf Ihrem Haus selbst geplant und installiert haben. Gern bestätigen wir Ihnen, dass dies keine Auswirkungen auf den Versicherungsschutz hat. Es besteht voller Versicherungsschutz für Schäden, für die Sie als Betreiber und Eigentümer der Anlage gesetzlich haftpflichtig gemacht werden können.', '', 'Mit freundlichen Grüßen ...""', '', '', 'Die aktuelle Wohngebäude muss ich leider wechseln, hier zeigte man sich wenig bemüht - es gibt bei den nur den Auswahlknopf ""von Fachfirma"" installiert.', 'Aber auch hier kommen schon die ersten Angebote rein.', 'Du brauchst für Fremdschäden, die deine PV-Anlage verursacht, eine Betreiberhaftpflicht.', 'Wenn zum Beispiel bei Sturm ein Modul absegelt und ein fremdes Auto beschädigt.(Sach- und Personenschäden)', 'Eigenmontage ist bei einigen Versicherern möglich. Meist mit Auflagen im ""kleingedruckten"".', 'z.B.', '.. Die Installation hat nach den anerkannten Regel der Technik zu erfolgen und muss durch einen Fachbetrieb abgenommen werden..........', '', 'mfg', 'Hast du bei deiner privat Haftpflicht nachgefragt ob die für Fremdschäden bei deiner PV haften?', 'Einige ""Kinken"" auf die geachtet werden sollte sind nach bei meiner Recherche:', '', 'Technologiefortschritt', 'Erdbeben ( wenn in Gebiet wohnhaft)', 'Schneedruck ( Verwehungen kann es fast immer geben)', 'Sturm ( meistens wird nur bei bestimmter Windstärke geleistet)', '', 'nicht nur Feuer sondern auch Schwelbrand, Glimmen etc ( Hierbei begrenzen manche Versicherer bei 25.000, das kann mal schnell erreicht sein)', '', 'Bedienungsfehler', '', 'Allmählichkeitsschäden', 'sofortiger Reparaturbeginn möglich', '', '', '', 'möglich aber vielleicht nicht zwingend', '', 'GAP Deckung wenn Anlage finanziert wurde', 'Minderertragsversicherung', '', '', 'Manche Private Haftpflichtverträge decken dies zwar ab , aber begrenzen dann die kWp Grösse', 'Guten Morgen, alles gute Punkte.', 'Es ging in der Initialfrage aber tatsächlich ""nur"" um die notwendigen Versicherungen', '1. private Haftplicht', '2. Wohngebäudeversicherung', 'und deren Deckung im Schadensfalls bei EIGENBAU.', '', 'Hier ist der aktuelle Status:', '1. die private Haftplicht hat mir sofort schriftlich bestätigt, dass Schäden an Dritten, verursacht durch meine PV Anlage, abgesichert sind', '2. die Wohngebäude-V die ich bis dato hatte, wollte dies nicht akzeptieren. Aber ich habe jetzt einige neue Angebote die mir schriftlich bestätigen, dass das Wohngebäude Schutz/Absicherung genießt - auch mit der selbst aufgebauten PV Anlage.', '', 'Diese Punkte sollte jeder mal in seinen Verträgen prüfen, der seine Anlage selber aufgebaut hat, denn in vielen Vetragsbedingungen stehen solche oder ähnliche Klauseln:', 'A. ...Aufbau/Installation durch einen Fachbetrieb...', 'B. .... durch das jeweilige Gewerk Qualifizierten Fachbetrieb...', 'C. .... vom Hersteller empfohlenen Intervall vom Fachbetrieb prüfen lassen...', '', 'Alles nicht unwichtig wenn beim Sturm ein Modul in Nachbars neuen VW Bus fliegt oder gar das Haus brennt, verursacht durch die selbst aufgebaute PV Anlage.', 'Nur als Ergänzung, diese Variante gibt es auch:', 'Gemäß §4711 Abs. 3 der Vertragsinformationen gilt eine Photovoltaikanlage mitversichert, sofern Sie auf dem Hausdach befestigt und in den Baukörper integriert ist.', 'Wer die Photovoltaikanlage aufgebaut hat, ist hierbei nicht ausschlaggebend.', 'Hallo TomJerry,', '', 'von welchen Versicherungsunternehmen hast du Angebote erhalten die Eigenbau PV Anlagen in der Wohngebäudeversicherung versichern?', 'Bin aktuell bei der HUK24, da ist dies ausgeschlossen..', '', 'Vielen Dank', 'Ich denke das ganze steht und fällt mit welchen Argumenten (Qualifikationen) man an die Versicherungsgesellschaft herantritt. Sicherlich hat man zum Beispiel als Herzchirurg schlechtere Chancen als ein Elektriker oder/und Ingenieur die Versicherung von einem Selbstbau der PV zu überzeugen?', '', 'Nimm die top 10 aus der Stiftung Warentest zu den Wohngebäudeversicherungen, hierbei hatte mir niemand meinen Wunsch/Klausel abgelehnt. Lediglich ""meine"" DEVK wollte mir mein Haus nicht weiter versichern.', '', 'Schaue dir die Versicherungsbedingungen trotzdem gut an. Das steht nicht nur ""Installation vom Fachunternehmen"", sondern auch schon einmal eine Klausel wie ""Wartung alle drei Jahre vom Fachunternehmen).', 'Ich hoffe das hilft?', 'Hallo TomJerry,', '', 'danke dir, ich mach mich mal ran und lese mir die Versicherungsbedingen durch..']"
Ratlos: Wie kann ich Wohngebäude und PV-Ausfall versichern,"['Ich bin einigermaßen ratlos:', '', 'In meinem Altvertrag zur Wohngebäudeversicherung lässt sich die PV-Anlage nicht ""nachmelden"" .', '', 'Bei Neuabschluss ist die PV-Anlage auf 25.000 € beschränkt.', 'Ob das bedeutet, dass ich bei > 25.000 €', '- keinen Vertrag bekomme oder', '- nur bis 25.000 € max entschädigt wird oder', '- nur im Verhältnis zum tatsächlichen Anschaffungspreis', 'muss ich noch klären, aber keine der 3 Varianten gefällt mir.', '', 'Deshalb hab ich mir gedacht, ich such eine Versicherung, die PV mitversichert.', 'Da ist dann aber kein Ertragsausfall abgesichert, wenn z.B. ein Marder zuschlägt und ich 6 Monate keinen Handwerker finde.', '', 'Eine separate PV-Versicherung zahlt nur die 7 Cent Einspeisungs-Verlust, nicht meine Mehrkosten von 35 Cent, wenn ich Strom aus dem Netz beziehen muss.', '', 'Hab ich da nur die falschen Versicherungen erwischt?', '', 'Darf man hier im Forum die Namen der Versicherungen nennen?', '', 'Hat jemand eine Wohngebäudeversicherung mit PV und Wärmepumpe und', 'in dieser Wohngebäudeversicherung oder mit einer separaten PV-Versicherung das Ausfallrisiko ""Netzbezug"" während Reparaturdauer abgesichert?', 'Ertragsausfall abgesichert, wenn z.B. ein Marder zuschlägt und ich 6 Monate keinen Handwerker finde', 'Äußerst selten. Versicherung über 20 Jahre kommt teurer als der Ausfall.', '', 'Ich hab Versicherung gekündigt.', 'Hattest Du nur den Einspeisungsertrag versichert oder auch den Netzbezug?', 'Unsere Versicherung war nun mit Anlagenklauf von Juni 2021 bis Ende 2022 inkl.:', 'Photovoltaik – Beratung, Planung u. Montage von Photovoltaik Anlagen (PV) und Stromspeicher. Einspeisevergütung, Förderungen & Wirtschaftlichkeit.\nwww.enerix.de', '', 'bzw. https://lumit.net/solaranlagenversicherung.html', '', 'Verlängert sich nicht automatisch, aber Enerix schreibt wohl jeden Anlagen Neubesitzer im Sept./Oktober Zeitraum an, ob und zu welchen Konditionen die Versicherung verlängert werden kann/soll. Für den Vollschutz, noch zu klären ob dann auch die Betreiberhaftpflicht inkl. ist, sollen wir wohl rund knapp über €100,-/Jahr zahlen. Weil Anlage über Enerix gekauft, wohl entsprechende Sonderkonditionen…', '', 'Sprich, wird nun auch gleich nochmal Thema für uns und ich werde dann genau vergleichen - sind ansonsten mit dem meisten Zeugs bei der Itzehoer und hatten da natürlich auch in 2021 zumindest bei der Gebäudeversicherung unsere PV nachgemeldet.', '', 'Lange Rede kurzer Sinn, ich halte zumindest eine Betreiberhaftpflichtversicherung für sinnvoll. Ich denke die Alleine sollte für ein paar Euros/Jahr, definitiv unter €100,- zu bekommen sein. Vollkasko, Ausfall, etc. für uns eher zweitrangig. Auf der anderen Seite, ginge heute einer unser Fronius WR, etc. kaputt, wäre auf Monate mit keinem Ersatz zu rechnen weil keiner liefern kann… sollte/muss jeder selber beurteilen/abwägen.', 'auch Enerix sagt:', 'Es scheint, dass PV-Versicherungen für Stromproduzenten entwickelt wurden, die Gewinne durch Einspeisung erzielen wollen.', 'Diese können den Gewinn-Ausfall versichern.', '', 'Die Versicherungen haben völlig verschlafen, dass Hausbesitzer den eigenproduzierten Strom nutzen wollen und dazu hohe Kosten für Speicher in Kauf nehmen um möglichst wenig einspeisen zu müssen.', 'Nur die Einspeise-Verluste sind versicherbar.', '', 'Ich suche eine Versicherung, die das nicht verschlafen hat und mir den teuren Zukauf übers Netz erstattet!', 'Ich suche eine Versicherung, die das nicht verschlafen hat und mir den teuren Zukauf übers Netz erstattet!', 'Gibt es offensichtlich - sofern Du den Nutzungsausfall nicht nachweisen kannst, €2,5/kWp und Tag:', '', 'https://rechner.krist.com/files/pdf/pv/Handout-SunSafeTop-BHP.pdf', '', 'Photovoltaikversicherung – die sichere Wahl für Ihre Anlage', 'Leider auch nicht:', '', 'NUTZUNGSAUSFALL', 'Ebenfalls mitversichert ist der Nutzungsausfall infolge eines versicherten Sachschadens. Der Nutzungsausfall wird in voller Höhe ersetzt.\nKann der Nutzungsausfall nicht nachgewiesen werden, beträgt die Tagesentschädigung je kWp Anlagenleistung 2,50 EUR.\nBei Teil- und Totalschäden wird die Entschädigung anhand der schadenbedingt nicht zur Verfügung stehenden Anlagenleistung ermittelt. Die Entschädigungsleistung ist insgesamt begrenzt auf die, mit der vom Schaden betroffenen Anlage bzw. Teilanlage im Ausfallzeitraum maximal erzielbaren Vergütung aus der Stromeinspeisung.', 'Wenn ich also eine Null-Einspeisungs-Strategie habe (und das auch erreiche) bekomme ich maximal 0 € ersetzt.', '', 'Das ist also auch eine PV-Versicherung für Leute, die das Ziel haben möglichst viel einzuspeisen.', 'Die gab es früher ja sicher viele.', '', 'Wer heute aber eine neue PV baut, will doch eher möglichst wenig einspeisen und wenn er es doch nicht vermeiden kann,', 'bekommt er ja fast nichts mehr dafür.', '', 'Deshalb sage ich ja, die Versicherungen haben den Trend verschlafen.', 'Wenn ich also eine Null-Einspeisungs-Strategie habe (und das auch erreiche) bekomme ich maximal 0 € ersetzt.', 'Ich lese das (Nutzungsausfall) komplett anders heraus - aber anstatt hier Silbertablett Antworten zu verlangen, rufe doch selber da an und lasse es Dir erklären - und dann erkläre es uns.', 'Also, ich habe mich gerade auch mit Versicherungen beschäftigt. Es gibt eine Versicherung von der BAY WA Re und das hat sich ganz gut angehört.', 'Man zahlt einen Beitrag komplett für 10 Jahre.', 'Das scheint günstig, ich habe selbst aber noch nicht verstanden warum nur 10Jahre...', 'Photovoltaikversicherung exklusiv für Ihre Kunden\nSofortiger und umfänglicher Versicherungsschutz für alle Komponenten von Photovoltaikanlagen – ein Produkt der GGW.\nsolar-distribution.baywa-re.de', '', 'PV Insurance', 'Ja, von den Konditionen und vom Preis sind die sehr gut!', '', 'Mich irritiert die Vorauszahlung für 10 Jahre und dass sie nur max 1 Jahr alte PVs versichern.', 'D.h. dann nach 10 Jahren steht man ohne Versicherung da?', '', 'Ich hab mittlerweile herausgefunden dass die HUK Coburg Wohngebäudeversicherungen mit PV Zusatzpaket anbietet 88 € / Jahr, das auch den nicht möglichen Eigenverbrauch versichert.']"
